{"counts":{"errors":0,"marginalia":2,"rejected_marginalia":0,"units":2},"findings":[],"reading_id":"urn:uuid:b385225f-578c-4d75-ab38-d228849feab9","reading_product_sha256":"795f6ee1cc583807f817488b65fcad96ea6b2ed10203e7afad66d7badeff83e5","schema_version":"reading-product-validation-report/1.0","source":{"book_document_substrate_sha256":"bba7527cd7c22aad0a51319611f0600c6b8695adc4409dfe136c4d86e4c7b183","epub_sha256":"1325ba2f76406fb22a1bb0f02edd735983cc150f64cc4af5bb00fbf6d873f7a7"},"status":"valid","validator_version":"1.0.0"}
